<?xml version="1.0" encoding="UTF-8"?>
<trans xmlns:xsi="http://www.w3.org/2001/XMLSchema-instance" xsi:noNamespaceSchemaLocation="../trans.xsd">
    <tran tranCode="TranMMBG01" tranName="个人密码修改">
        <comps>
            <comp compCode="CompMMBG01" compName="个人密码修改" expression="">
                <inParams>
               		<inParam ignoreNull="0" paramCode="accnum" paramName="个人账号" paramType="string(1,30)" paramValue="accnum"/>
               		<inParam ignoreNull="0" paramCode="certinum" paramName="证件号码" paramType="string(1,30)" paramValue="certinum"/>
               		<inParam ignoreNull="0" paramCode="oppwd" paramName="柜员密码" paramType="string(1,30)" paramValue="oppwd"/>
               		<inParam ignoreNull="0" paramCode="pwd" paramName="密码" paramType="string(1,30)" paramValue="pwd"/>
                </inParams>
            </comp>
        </comps>
    </tran>
</trans>