<?xml version="1.0" encoding="UTF-8"?>
<trans xmlns:xsi="http://www.w3.org/2001/XMLSchema-instance" xsi:noNamespaceSchemaLocation="../trans.xsd">
    <tran tranCode="TranGRFCXXSC2" tranName="职工封存">
        <comps>
            <comp compCode="CompBatchPostTransaction" compName="职工封存" expression="">
                <inParams>
                    <inParam ignoreNull="1" paramCode="apiId" paramName="交易码" paramType="constant"
                             paramValue="upGRFCXXSC2"/>
                    <inParam ignoreNull="1" paramCode="apiName" paramName="交易描述" paramType="constant"
                             paramValue="职工封存"/>
                    <inParam ignoreNull="1" paramCode="fileCols" paramName="批量文件字段定义" paramType="constant"
                             paramValue="dp077:dp077,GRZH:accnum1,XINGMING:accname1,ZJHM:accnum2,SEQNO:seqno,GRJCJS:amt1,AMT1:amt2,AMT2:unitprop,JZNY:freeuse1,PAYVOUAMT:freeuse2,INSTANCE:instance,DPBUSITYPE:dpbusitype,DWZH:unitaccnum1,TRANSDATE:transdate,AGENTINSTCODE:unitaccname1,AGENTOP:unitaccname2,PROPTYPE:payvounum"/>
                    <inParam ignoreNull="1" paramCode="fileField" paramName="上传文件字段名" paramType="constant"
                             paramValue="file"/>
                    <inParam ignoreNull="1" paramCode="batchDataListId" paramName="批量列表id" paramType="constant"
                             paramValue="grqfList"/>
                </inParams>

            </comp>
        </comps>
    </tran>
</trans>
